{
  "masterTrack": "Audio",
  "imageClip": {
    "artifact": "ImageSegments[segment]",
    "effect": "KennBurns"
  },
  "videoClip": {
    "artifact": "VideoSegments",
    "volume": 0.0,
    "fitStrategy": "auto"
  },
  "audioClip": {
    "artifact": "AudioSegment",
    "volume": 1.0
  },
  "musicClip": {
    "artifact": "Music",
    "volume": 0.2,
    "playStrategy": "loop"
  },
  "tracks": [
    "Image", 
    "Audio", 
    "Music"
  ]
}